job_id,title,company,job_description,link_url,image
3656666849,"Lead Concept Artist, Games Studio (Blue)",Netflix,"We’re looking for a creative and highly-skilled Lead Concept Artist to help us forge the creative vision for a brand-new AAA multi-platform (PC, mobile, etc) game. This is a unique opportunity to be at the heart of crafting and bringing to life worlds for one of Netflix’s first generation of internally developed original games.As Lead Concept Artist, you will have a meaningful role to play in shaping and directing the world that we are creating. The ideal candidate is a well-organized leader with a strong, hands-on background with a devotion to sharing and mentoring. You’ll be responsible for generating a variety of industry-leading AAA character and environment concepts, as well as helping with game design elements for the project. You’ll work closely with the development teams to create environments along with unique and compelling characters that exude personality and help push the visual style.We're building the foundation for a small, but ambitious, team of creators whose primary goal is to create a game experience that our players want to repeatedly come back to; and as our Lead Concept Artist, you will be able to create, ship, and help run a game without any competing design constraints due to monetization.Quality is something that we are immensely proud to be aiming for, and we are looking at putting the right team together to help take us forward. We’re looking for that group of leaders who are aligned with our core values, and care deeply about the experiences they create as well as the people they make them with. Those who bias towards action and are energized by the learning that comes with bold experimentation at an agile pace. As a part of Netflix, we strive to hire the best and value integrity, excellence, respect, inclusion, and collaboration.Now is an amazing time to join Netflix as we seek to entertain the world. We have over 200 million paid members in over 190 countries, and we won’t stop there.ResponsibilitiesBe the artistic leader and take ownership of delivering high-quality, distinction, and style for our environments.Works closely with the Art Director to help drive the art style and evolve the vision of the projectAbility to help mentor and coach a growing team of concept artistsCollaborate with the art team to implement and maintain the creative vision for the gameImplement initial game features within the game prototype in Unreal Engine; Focus on rapid prototyping to quickly iterate to ""find the look""Coordinate with other art, design, and production teams to help accomplish the goals of the projectRequirementsMinimum 10+ years of relevant experience with 3+ years of it being in a lead/ senior artist roleHas worked on at least one AAA title as a team lead and has experience leading an external art team.Has an excellent understanding of art pipelines, dependencies, and the overall scope of the projectStrong communication skills and understanding of various art disciplines (animation, character, environment, VFX)Experience designing detailed, modern and forward-looking characters.The ability to storyboard and help conceptualize character movement and VFXYou can arbitrate sensitively between creative desires and production requirements.Ability to design for a range of art directions, from photo-realistic to stylizedStrong leadership and mentoring abilities and interpersonal skillsAbility to find creative solutions for technically challenging tasksNICE TO HAVEWillingness to receive directions and work closely with a teamExperience with Zbrush and MayaExperience with Epic's Unreal EngineVFX concept experiencePassion for gamingA passion and understanding of world-buildingStrong portfolio that demonstrates a range of 2D and 3D conceptsAt Netflix, we carefully consider a wide range of compensation factors to determine your personal top of market. We rely on market indicators to determine compensation and consider your specific job, skills, and experience to get it right. These considerations can cause your compensation to vary and will also be dependent on your location.The overall market range for roles in this area of Netflix is typically: $250,000 - $500,000This market range is based on total compensation (vs. only base salary), which is in line with our compensation philosophy. Netflix is a unique culture and environment. Learn more here.",https://www.linkedin.com/jobs/view/3656666849,https://media.licdn.com/dms/image/C4E0BAQEVb0ZISWk8vQ/company-logo_100_100/0/1519896425167?e=2147483647&v=beta&t=MUfnRIPJkQ4S9chO-LfQYm84RLmN-xI-q9ZMjPG1cAs
3651989191,GM / Project Lead - Games Studio,Netflix,"We are looking for a highly skilled and experienced General Manager to help us manage and grow a portfolio of games in one of our product lines. These titles are created by internal teams, as well as in partnership with external content and development teams. You will lead and grow a multi-disciplined team to deliver best in class experiences for our customers and be responsible for the overall performance and scaling of the portfolio.The ideal candidate will be highly organized and able to effectively partner with our teams to prioritize and align feature, title, and content roadmaps. Your main focus will be bringing together all functions of the development teams and providing leadership, direction and accountability on a day to day basis while improving operational efficiency.ResponsibilitiesCollaborate with stakeholders: Define and align on high level product goals, titles, schedule, and KPI’s.Lead the development effort: Responsible for owning the portfolio strategy and overseeing all facets of the development across multiple departments and development teams. Communicate the vision within your team, the company and externally to players.Scale and Grow Business: Build passion and momentum, attract, develop, inspire, and lead high performers, creating a culture that motivates, grows and retains the world-class talent.Central Partnerships: Work in deep partnership with central groups, leveraging consumer and market insights, as well as platform and channel expertise to drive effective go-to-market strategies, and work to continually push our product to the top of the charts.Budget and P&L: Responsible for managing the overall project budget, forecasting, staffing, licensing, outsource costs, and reportingLive Operations: Use data to ensure our products are released into a live environment on a regular schedule that drives KPI’s and generates excitement and retains customers.Skills And AbilitiesAbility to collaborate and creatively problem solve across multi-function teamsAbility to quickly identify and prioritize opportunities for optimal resultsStrong analytical skills with experience using data to inform decision makingA passion for gaming with extensive knowledge of the industry and trendsExcellent verbal and written communication skills up, down and outwardEducation and ExperienceAt least 8+ years of experience in a GM or Senior development role with a successful track record of driving engagement, and player satisfaction in mobile gamingProven experience operating and growing a top mobile titlePrior experience in a startup companyExperience managing or mentoring multi-disciplinary teams and leadersAdaptable with the ability to collaborate and efficiently lead multiple distributed teamsMBA or equivalent experiencePosition Type/Expected Hours of WorkOur core hours are 10am to 6pm cst, which means you should be available for meetings etc. during this time.Other DutiesPlease note this job description is not designed to cover or contain a comprehensive listing of activities, duties or responsibilities that are required of the employee for this job. Duties, responsibilities, and activities may change at any time with or without notice.At Netflix, we carefully consider a wide range of compensation factors to determine your personal top of market. We rely on market indicators to determine compensation and consider your specific job family, background, skills, and experience to get it right. These considerations can cause your compensation to vary and will also be dependent on your location.The overall market range for roles in this area of Netflix is typically $150,000 - 500,000This market range is based on total compensation (vs. only base salary), which is in line with our compensation philosophy. Netflix is a unique culture and environment. Learn more here.",https://www.linkedin.com/jobs/view/3651989191,https://media.licdn.com/dms/image/C4E0BAQEVb0ZISWk8vQ/company-logo_100_100/0/1519896425167?e=2147483647&v=beta&t=MUfnRIPJkQ4S9chO-LfQYm84RLmN-xI-q9ZMjPG1cAs
3612784559,"Manager, Marketing Partnerships - Ads Marketing Creative Operations",Netflix,"It's an exciting time to join Netflix as we continue to transform entertainment globally. We bring new stories to over 233 million subscribers in over 190 countries. This requires great Content, a frictionless Choosing experience, and engaging Conversation. As we continue to grow, we’re increasingly focusing on Commerce as well. We’ve recently introduced a new ad-supported plan, offering customers a more affordable price point and offering advertisers a new way to reach engaged audiences.We are building out an Ads Marketing team to bring to life our Ads positioning and key narratives. The Ads Marketing team will sit within the Netflix Marketing Partnerships function. We are seeking an ‘Ads Marketing Creative Ops Producer’ to bring to life the ‘Netflix with Ads’ positioning, messaging and key narratives. This is done by coordinating and coalescing the tools, resources, and cross-functional alignment needed to produce and implement Sales Enablement materials to the highest creative standards.THE ROLEExperienced program manager / producer (7+ years) within the integrated marketing / ad sales industry (entertainment studio, broadcast/streaming service, creative marketing, etc.) with a deep understanding of how to creatively support an Ads Sales organization. This will cover everything from logistics/creative production, resource management, project management and financial management, to cross-functional coordination and sales/advertiser/agency management (and more). While not a creative practitioner, the ideal candidate will have a sharp eye and strong passion for creative excellence.Creative Production And PlanningProject management and operations for Ad Sales/Marketing creative requests and delivery (efficient workflow, agency engagement, timeline/budget management, cross-functional coordination, etc.)Develop a project plan that drives timeline, budget and key cross-functional stakeholder milestones. Partner with agency partners to develop and adhere to plans.Stay closely aligned with the Sr. Director Ads Marketing and creative team to ensure flawless implementation of all projectsProject ImplementationAct as day-to-day contact for cross-functional socialization and approvals for all sales enablement assets required. This includes teams such as sales, creative marketing, content, legal, music, PR/Comms, media, etc.Executional oversight and coordination of all creative sales enablement materials (presentations, video, print, talent/legal, social media/content, activations/events, PR, etc.)Assist in the development of creative presentations, including presentation design, creative mockups and working across the team to collaborate on the deckOwn & manage budgets including negotiating agency estimates/bidsEnsure all necessary assets are reviewed, approved and delivered on-time. This includes prior alignment and approvals with all necessary cross-functional partners.Team Management And OperationsAct as main liaison in facilitating sales enablement asset requests as well as manage the retrieval of any/all title specific asset needsBecome an expert in the utilization of Netflix internal tools, in order to properly support the Ads Marketing creative lead as well as all external agency partners / vendorsManage creative agency NDAs, SOWs and creative agency onboarding as needed We Seek An Inspired Individual WhoMinimum 7+ years of experience on integrated marketing, Sales and/or program execution, preferably with experience in an entertainment or Ad Sales environmentDeep experience and understanding in creative sales enablement and program management - working on fast paced projects that involve multiple stakeholders, content production, and media activations.Experience within a film or TV studio environment, including working with content and marketing team.Fluent in Video and Digital types and formats while understanding the fundamentals of asset management, servicing and ad trafficking.Experience with marketing creative concepting, asset production, and delivery.The best candidate will have strong written/verbal skills, ability to multi-task and ability to manage and edit graphic designs and deck templates.Can organize, clarify and communicate complex ideas quickly, succinctly and accurately. Has quick intelligence, is fast on their feet, and quickly responds to inquiries and questions.Can flourish in our unique company culture.At Netflix, we carefully consider a wide range of compensation factors to determine your personal top of market. We rely on market indicators to determine compensation and consider your specific job family, background, skills, and experience to get it right. These considerations can cause your compensation to vary and will also be dependent on your location.The overall market range for roles in this area of Netflix is typically $175,000 - $445,000This market range is based on total compensation (vs. only base salary), which is in line with our compensation philosophy. Netflix is a unique culture and environment. Learn more here.",https://www.linkedin.com/jobs/view/3612784559,https://media.licdn.com/dms/image/C4E0BAQEVb0ZISWk8vQ/company-logo_100_100/0/1519896425167?e=2147483647&v=beta&t=MUfnRIPJkQ4S9chO-LfQYm84RLmN-xI-q9ZMjPG1cAs
3612781943,"Stills Curation Specialist, LATAM",Netflix,"We are looking for a highly trained photo editor to join the Photo & AV Studio team as a Stills Curation Specialist. This role will support the visual merchandising experience on the Netflix product across all product UI (user interface) and platforms as well as working with off-product promotional teams for additional photography needs within a broader strategy.Your primary role will be selecting image assets directly from the video source files of film and television content and providing creative content strategy on a per title basis for our LATAM original titles. This position will work closely with global teams in UCAN, EMEA and APAC as a partner and representative for LATAM. The work includes alignment with regional Product Creative, Photo & AV Studio and Publicity teams in Latin America; so an ability to proactively find connections to drive effective execution of strategy and influence global systems is key.ResponsibilitiesCurating imagery for Standalone assets.Including Series, Feature Films, Documentaries, Animation, Stand Up Specials and Reality Shows.Curating imagery for Episodic assets (thumbnails) on service.Curating imagery for Trailer and Supplemental Content thumbnails on service.Quality Control (QC) of assets to ensure excellence on product platform and press outlets.Leading imagery curation for specific publicity supported titlesPhoto editing on title events when necessarySkillsCreative/Editorial background in regards to a local Latin American-specific film and television industry is preferred.Photography or editorial experienceExtensive knowledge of Adobe Suite including Photoshop and Lightroom is preferred.Previous experience in production/editing.Experience with digital asset management and or content management systems is a plus.Ability to manage projects from end-to-end with no supervisionAbility to provide constructive feedback in a positive way when needed.Detail oriented, problem solver and good communication skills are key.Nice to have: Design experience",https://www.linkedin.com/jobs/view/3612781943,https://media.licdn.com/dms/image/C4E0BAQEVb0ZISWk8vQ/company-logo_100_100/0/1519896425167?e=2147483647&v=beta&t=MUfnRIPJkQ4S9chO-LfQYm84RLmN-xI-q9ZMjPG1cAs
3651907395,"Business Process Analyst, Finance Automation",Netflix,"Netflix is the world’s leading streaming entertainment service with over 233 million paid memberships in over 190 countries enjoying TV series, documentaries, feature films, and mobile games across a wide variety of genres and languages. Members can play, pause and resume watching as much as they want, anytime, anywhere, and can change their plans at any time.Role DescriptionIn this new role reporting to the Head of the Finance Program Management Office (PMO) you will play a critical role in optimizing our organization's operational efficiency and effectiveness by leveraging automation solutions such as Robotic Process Automation (RPA), Machine Learning (ML), Intelligent Document Automation and Process Mining. You will be responsible for analyzing existing business processes, identifying areas for improvement, and implementing solutions to enhance productivity, streamline workflows, and drive sustainable growth. You will work with Finance leaders across various domains and geographies to understand current workflows, identify pain points and implement policy, process, data, and automation recommendations.This role sits within Finance and will require close collaboration with Finance stakeholders and engineering teams. This is a hybrid position that can be based in either Los Angeles or Los Gatos and offers the flexibility to work remotely part of the time. Occasionally travel may be required to other office locations, including internationally.ResponsibilitiesWork with business stakeholders to identify workflow inefficiencies and automation opportunities.Facilitate workshops with stakeholders to understand process pain points and recommend the best combination of process reengineering and automation to deliver the most value.Perform root cause analysis to identify solutions that address the true source of issues.Influence policy and process decisions to effectively utilize existing applications without the need for customization or automation when it makes sense.Partner with Solution Engineers to determine project feasibility, level of effort and ROI.Determine the prioritization of automation opportunities across various Finance teams and manage the automation pipeline.Manage negotiations between teams and across organizational lines to promote the most effective and consistent global solutions.Conduct comprehensive analysis of current business processes, including gathering and documenting requirements, workflows, and data flows using standard business process modeling (BPM) techniques.Contribute to the overall maturity of the function through development of tools/templates and by providing education to peers and business partners.Qualifications5+ years in business process analysis and business process engineeringDemonstrated expertise in providing process recommendations and standardizing global processesExperience with Order to Cash, Procure to Pay and Record to Report processesExperience with robotic process automation, machine learning and intelligent document automationProficiency using Visio, Signavio or other BPM tools Familiarity with tools such as UIPath, Automation Anywhere, CelonisBusiness Process Management certification a plusLean Six Sigma knowledge is an advantageAt Netflix, we carefully consider a wide range of compensation factors to determine your personal top of market. We rely on market indicators to determine compensation and consider your specific job, skills, and experience to get it right. These considerations can cause your compensation to vary and will also be dependent on your location.The overall market range for roles in this area of Netflix is typically $60,000 - $290,000.This market range is based on total compensation (vs. only base salary), which is in line with our compensation philosophy. Netflix is a unique culture and environment. Learn more here.",https://www.linkedin.com/jobs/view/3651907395,https://media.licdn.com/dms/image/C4E0BAQEVb0ZISWk8vQ/company-logo_100_100/0/1519896425167?e=2147483647&v=beta&t=MUfnRIPJkQ4S9chO-LfQYm84RLmN-xI-q9ZMjPG1cAs
3698214238,Contingent Talent Project Manager,Netflix,"Netflix is the world's leading streaming entertainment service with 236 million paid memberships in over 190 countries enjoying TV series, documentaries, feature films and mobile games across a wide variety of genres and languages. Members can watch as much as they want, anytime, anywhere, on any Internet-connected screen. Members can play, pause and resume watching, all without commercials or commitments.As Netflix grows and expands, it is becoming increasingly important to diversify the workforce in terms of worker types, geographic locations, and business lines. The company is focused on building a strong infrastructure that will allow for operational excellence and provide great experiences for people as they move into and within the rapidly growing organization.Netflix is committed to providing its employees with the support and resources they need to succeed and thrive in this dynamic and fast-paced environment.This role is part of the Talent Experience Operations (TEO) team which designs and runs the infrastructure to deliver an outstanding talent experience from candidacy to onboarding and beyond. The Contingent Talent team under TEO is focused on hiring a Project Manager to be instrumental in the digital evolution and sustaining our scale. Contingent Talent is responsible for managing the company’s non-employee workforce from sourcing, onboarding, management, and offboarding.In This Role, You WillSupport the team with various tools and/or vendors, ensure we leverage tools’ capabilities, play a critical role in delivering the strategic roadmap, and implement new systems, tools, and workflowsDesign, plan and deliver on strategic initiatives with your strong project management skillsResearch and resolve any problem that comes your way with recommendations or creative solutions.Work with cross-functional teams to design and evolve our systems and processes to simplify the user experience and ensure data integrity for intelligenceConfigure and maintain our systems to meet requirements and test enhancements for quality assurance. Consult and act as the bridge between business teams, technical teams and data teams to gather requirements.Create journey maps of the different Netflix people's experiences and enabling different roles to be effective by creating and maintaining critical visualizations and documentationCommunicate and collaborate effectively by simplifying complexity and ensuring each persona is met with key context and narratives to succeedChampion change by bringing the end-users along the journey in order to ensure partnership, understanding, and accountability to make the required changes to support long-term success.Provide expertise on global business intelligence in various markets to influence the evolution while enabling the expansion of Netflix’s workforceWe Want Someone Who Is3-5 years of internal HR operations or contingent workforce experience with a strong preference for experience managing and implementing talent tools including but not limited to VMS (required), ATS, or HRISConduit between the data and the business to advise on solutions for our workflowsProactive and contributive; takes the initiative and follows-through reliablyExtremely organized, detail-oriented, and a speedy learnerStrong project manager and can forecast, meet tight deadlines and hold others accountableA motivated self-starter, able to thrive in a fast-paced environment with quickly changing business needsStrong analytical skills and ability to tell a story with insights and trendsStrong critical thinking and communication skills to connect the dots and share the impact of your recommendationAt Netflix, we carefully consider a wide range of compensation factors to determine your personal top of market. We rely on market indicators to determine compensation and consider your specific job, skills, and experience to get it right. These considerations can cause your compensation to vary and will also be dependent on your location.The overall market range for roles in this area of Netflix is typically $80,000 - $335,000.This market range is based on total compensation (vs. only base salary), which is in line with our compensation philosophy. Netflix is a unique culture and environment. Learn more here.",https://www.linkedin.com/jobs/view/3698214238,https://media.licdn.com/dms/image/C4E0BAQEVb0ZISWk8vQ/company-logo_100_100/0/1519896425167?e=2147483647&v=beta&t=MUfnRIPJkQ4S9chO-LfQYm84RLmN-xI-q9ZMjPG1cAs
