job_id,title,company,job_description,link_url,image
3634496009,Software Engineer (L5) - iOS Foundations,Netflix,"The TeamThe iOS Client Foundations team shepherds and builds foundational architecture and frameworks which powers the Netflix iOS app. Our 3 core values are: Accelerate developer velocity, pave the path and set standards for App quality and experience metrics, pave the path to build scalable app architecture (foundational scaffoldings) & frameworks, documentation and communication for iOS platform across Netflix.Our responsibilities include implementing large-scale future looking foundational architecture and frameworks ranging from core UI frameworks to core infrastructure that enables existing and future innovations for product teams across Netflix. We care deeply about performance, quality, and accessibility of the Netflix app. We’re passionate about creating elegantly designed, highly performant architectures which empower engineers to build amazing UI experiences used by millions of users across the globe. We partner closely with teams across Netflix to help deliver solutions which make UI development efficient and enjoyable.We are part of a global, diverse organization that includes people of all people of all genders, sexual orientations, upbringings, nationalities, ages, and socio-economic & educational backgrounds. We encourage anyone who is passionate about building compelling mobile experiences that touch audiences around the world to apply.The RoleWe are looking for an engineer to lead the iOS core libraries, framework & infrastructure strategy and innovate how we uphold the high bar for product quality amidst growing product areas while accelerating developer velocity. This role’s impact and visibility will be felt by (but not limited to) the entire iOS development community at Netflix. The engineer in this role will be contributing to developer experience by building scalable libraries, frameworks & infrastructure to enhance development of the quick product feature iterations across the entire product engineering stack.Provide technical leadership to drive pragmatic, yet deeply impactful architectural decisions in logging and UI infrastructure that address both current and future product needs.Create scalable, modular, extensible, and highly performant custom UI components that are leveraged by engineers on a variety of teams.Strong advocate for building transparent observability tooling and solutions that enhance developer velocity.Set the vision and strategy for a robust and scalable logging framework that consolidates our customers’ varying needs (other engineering teams) in close collaboration with our data science team.Bring a wide variety of experience building frameworks/libraries with technologies like UIKit, Core Animation, Objective-C and Swift, and other Apple frameworks to the team.Refine or define hypotheses with our stakeholders in a data-driven approach that informs foundational strategy and innovations.Enable and ship complex product experiences with exceptional quality on a regular, rapid cadence.Find ways to detect and improve code health in a fast-paced, high commit volume culture of experimentation.Find solutions to prevent regressions in the product experience, and improve test stability, coverage & performanceWhat’s Different About UsScale, Impact : You’ll enable engineers across multiple teams and organizations at Netflix to create best-in-class streaming UIs used by hundreds of millions of members across a broad spectrum of devices worldwide.Unique Technical Challenges : We build framework solutions which are flexible enough to withstand the span of use cases introduced by rapid A/B test development, across a varied client stack, server and network performance landscape, all while being ergonomic to use for the engineers we support.Collaboration and Communication : It’s not all about the tech. We highly value the skills required to build strong relationships and collaborate effectively with a high performing, inclusive & supportive team of engineers.Freedom, Responsibility, Ownership : We believe in providing engineers with the business context they need, and then giving them the freedom and responsibility to define project scope, define/debate architecture, determine trade-offs, and figure out the implementation details.Our Culture : Lastly, but most importantly, we live by our values.What Sets You ApartYou enjoy pushing the boundaries of what technology can do, and exploring uncharted watersYou love the idea of your work empowering other engineers and strive to understand their use casesColleagues appreciate the unique perspectives and balanced views you bring to collaborationsYou value the opinion of others when fleshing out solutions, to fill out your blind spotsYou know that there is rarely a single ‘right’ solution, and are thoughtful about trade-offsCurious about a broad range of new or unfamiliar technologies, our consumer base, and product vision.Familiarity with Data centric approach to app development Always seeking different perspectives, feedback, and relevant information to comfortably navigate ambiguity.Effective at establishing strong relationships with cross-functional teams through clear communication.Self-starter comfortable with identifying opportunities, defining & driving forward-looking technical roadmaps Deeply care about the quality & performance of the product shippedAt Netflix, we carefully consider a wide range of compensation factors to determine your personal top of market. We rely on market indicators to determine compensation and consider your specific job, skills, and experience to get it right. These considerations can cause your compensation to vary and will also be dependent on your location.The overall market range for roles in this area of Netflix is typically $180,000 - $900,000.This market range is based on total compensation (vs. only base salary), which is in line with our compensation philosophy. Netflix is a unique culture and environment. Learn more here.",https://www.linkedin.com/jobs/view/3634496009,https://media.licdn.com/dms/image/C4E0BAQEVb0ZISWk8vQ/company-logo_100_100/0/1519896425167?e=2147483647&v=beta&t=MUfnRIPJkQ4S9chO-LfQYm84RLmN-xI-q9ZMjPG1cAs
3655773363,Employee Services Workday Associate,Netflix,"Netflix is the world's leading streaming entertainment service with 236 million paid memberships in over 234 countries enjoying TV series, documentaries, feature films, and mobile games across a wide variety of genres and languages. Members can watch as much as they want, anytime, anywhere, on any Internet-connected screen. Members can play, pause and resume watching, all without commercials or commitments.This position is part of the HR Shared Services team, operating in the role as the main point of contact for all HR inquiries from initial request through fulfillment, and will partner with our local and regional talent teams to identify solutions and resolve employee issues in a timely fashion (focused on Workday transactions and data input & accuracy). You will be expected to be independent and proactive, with a customer service mindset and great stakeholder management skills.ResponsibilitiesEnsure the accuracy of employee data through the management of employee systems and processesYou will assist with programs that reach all employees, ensuring they run smoothly, so employees can focus on doing the best work of their lives.You will have the opportunity to learn new tools and techniques that can then be applied to simplify, optimize and automate work across our Talent organizationHelp create, author and manage our HR knowledge base for our employeesAssist with analyzing, intaking and operationalizing new employee services (from pre-hire to offboarding)Performs system and testing audits as requested for data accuracy, integrity, and functionality; analyzes and document results and discrepanciesQualificationsDemonstrated proficiency with Workday HCM toolDemonstrated proficiency in Mass Uploads (EIB).Demonstrated project management, communication, and customer service skills.Strong analytical skills, including intermediate to advanced proficiency in sheets/excel.Strong attention to detail and the ability to deliver results in a fast-paced, high-growth environment.Ability to problem solve by using rigorous logic and methods to solve difficult problems.A degree in HR, Business, IT, or a related field is preferred but not required.Experience in Workday Data Analyst, HR discipline or as a HR Generalist (A plus!).Experience with Zendesk ticket system (A plus!).",https://www.linkedin.com/jobs/view/3655773363,https://media.licdn.com/dms/image/C4E0BAQEVb0ZISWk8vQ/company-logo_100_100/0/1519896425167?e=2147483647&v=beta&t=MUfnRIPJkQ4S9chO-LfQYm84RLmN-xI-q9ZMjPG1cAs
3674704011,"Picture Specialist, Post Services",Netflix,"The OpportunityAs Netflix continues to produce amazing content worldwide, we focus on creating the best services, facilities, and experiences for our filmmakers. The Netflix Studio is building in-house Post Production Services for the exclusive use of our shows. The Post Production Services team is charged with the strategy, implementation, and operational management of our purpose-built facilities, providing bleeding-edge technology, workflows, and services to our filmmakers. The team is committed to providing an unmatched experience: cultivating a creative environment, fostering filmmaker joy, and preserving artistic intent throughout the review and exhibition pipelines.The RoleThe Picture Specialist serves as the Post Services team’s expert on all imagining-related functions and focuses on establishing operational best practices and workflows to ensure the highest picture quality is maintained throughout our global facilities. This role will have a unique primary focus on critical screenings and reviews taking place in Netflix's in-house facilities around the world while providing exceptional service to Netflix’s Content Creative teams and the filmmakers working on our original shows.The ideal candidate is an expert in post-production color and imaging reviews and infrastructures and can own the operational application of the primary aspects of the field, including color science, technology, art, and technique. We are looking for a self-starting strategic thinker who can lead projects and initiatives and engage multiple stakeholders across the studio and industry. This is a unique opportunity to evolve our operations by innovating to optimize our services and remain on the cutting edge of the industry.As Part of the Post Services Team, You Will…Facilitate and operate creative and technical (critical) reviews, including grade reviews, HDR reviews, remote collaboration coloring sessions, VFX reviews, and evolve the services and use cases we offer over time as our business, studio, and technologies evolve.Provide excellent client and talent support, including directors, DPs, showrunners, etc, in Netflix-owned facilitiesLead projects and initiatives designed to innovate, enhance, and optimize color and imaging-related servicesCreate strategies and promote operationally driven solutions across multiple use cases, benefiting cross-functional teams and internal efficienciesOversee, support, and operate Netflix’s critical review rooms in Los AngelesOversee and support (mostly remotely with some travel) Netflix’s Critical Review Rooms in Brazil, Mexico, Mumbai, Seoul, Tokyo, etcProvide operator-level training to peers and partner teams when needed.Ensure accurate calibration workflows are performed routinely, achieving continuous confidence and trust in viewing experiences Partner closely with stakeholders in the Studio, including Post Production, VFX, and Content Executives, building strong trust with key stakeholders and developing a deeply rooted understanding of their needs, expectations, and prioritiesCollaborate with various engineering, color science, and workflow team to ensure alignment around global imaging review workflows and standards, while also working closely to execute each review according to its needs and specification.Bring online and deploy new Post Sevices facilities.Explore, test, and vet new technological solutions based on the operational needs of the team, the creatives, and Netflix productions and recommend implementationsAbout YouYou are experienced in the field of picture and online post-production and understand current motion picture best practices and toolsYou have critical eyes with the ability to assess the quality of a screening asset and environment, diagnose issues, and troubleshoot in real-timeYou have interacted with a variety of filmmakers and provided excellent service and support to facilitate a creative process. You understand their goals and expectations and can navigate with calm and clarity under pressure.You’re comfortable interacting with post-production, mastering, and DI professionals Must be a team player. You are committed to teamwork and strive to cultivate collaborative relationships with your colleagues.You are accustomed to working in a business environment and are able to effectively articulate technical concepts to non-technical audiences in speech and in writing.You are highly organized, efficient, detail-oriented, and solution-orientedComfortable working across time zones under a flexible schedule that enables collaboration with remote teams and a global stakeholder baseYou value working in a diverse and international environment and are excited by the opportunity to partner with people whose backgrounds and perspectives may differ from yours.QualificationsPrior experience working in fast-paced post-production, production, or studio environment in a client-facing, imaging-centered roleSome past experience in a VFX environment is preferredAdvanced proficiency in working with specialized post-production software and tools, including ColorFront Transkoder, Da Vinci Resolve. Shotgrid RV is a plusUnderstanding of display standards, color gamuts, gamma, ACES, color transforms and other creative imaging conceptsProven experience working with IMF, HDR, and Dolby Vision.Experience working with synchronous and asynchronous review collaboration and streaming solutionsFamiliarity with audio, video, and data communications protocols.Experience with display calibration, performing perceptual color calibrations between reference displays and LG OLEDs using CalMANFamiliarity with Shotgun, Avid Media Composer, Clipster, Baselight is a plusFluent or business proficiency in English.At Netflix, we carefully consider a wide range of compensation factors to determine your personal top of market. We rely on market indicators to determine compensation and consider your specific job, skills, and experience to get it right. These considerations can cause your compensation to vary and will also be dependent on your location.The overall market range for roles in this area of Netflix is typically $58,000 - $230,000.This market range is based on total compensation (vs. only base salary), which is in line with our compensation philosophy. Netflix is a unique culture and environment. Learn more here.",https://www.linkedin.com/jobs/view/3674704011,https://media.licdn.com/dms/image/C4E0BAQEVb0ZISWk8vQ/company-logo_100_100/0/1519896425167?e=2147483647&v=beta&t=MUfnRIPJkQ4S9chO-LfQYm84RLmN-xI-q9ZMjPG1cAs
3693894486,"Senior Manager, Sales Operations EMEA",Netflix,"Netflix is one of the world's leading entertainment services with 238 million paid memberships in over 190 countries enjoying TV series, films and games across a wide variety of genres and languages. Members can play, pause and resume watching as much as they want, anytime, anywhere, and can change their plans at any time.The core Advertising team is charged with building a new, best-in-class ads organization to establish Netflix as the premiere platform for advertiser partners and to drive advertising revenue across key markets.In This Role, You WillPartner with sales to build a high-performing sales organization that can represent Netflix’s offerings to our advertising customers. Implement and execute key functions of a sales team including territory/role/channel design, sales process management and improvement, data hygiene, and sales tool development. Define, build and maintain the sales inputs, forecasting and pipeline management of the global advertising business.Lead pipeline and business reviews on a recurring basisDesign and implement consistent ways to manage the sales process.Partner with sales to define their strategy and develop plans to execute. Scale a global sales operations team aligned with sales teams.Provide quantitative and qualitative analysis of program performance and track/ensure program and business impactExplore new strategic opportunities to inform the business roadmap.About YouAt least 10 years of experience in advertising and/or in Sales Operations teams” to “At least 10 years of experience in linear, connected TV and/or digital media, and in Sales Operations teamsDeep experience with the agency and direct-sold sales models. Experience leading and managing a team of individual contributorsInternational experience working across multiple countries in the EMEA region is requiredFluency in English and additional European languages is highly valuable (French/ German/ Spanish/ Italian)Self-starter with expertise in managing large-scale, complex projectsCollaborates effectively and embraces differing perspectives and experiences to make better decisionsDeep knowledge of the advertising landscape, across media channels and methods of buyingAbility to dive deep as well as understand the big pictureDemonstrated track record of innovating, challenging assumptions and implementing better approaches Proven ability to prioritize multiple projects",https://www.linkedin.com/jobs/view/3693894486,https://media.licdn.com/dms/image/C4E0BAQEVb0ZISWk8vQ/company-logo_100_100/0/1519896425167?e=2147483647&v=beta&t=MUfnRIPJkQ4S9chO-LfQYm84RLmN-xI-q9ZMjPG1cAs
3678240408,"Release Manager, Games-Operations",Netflix,"Netflix is looking for a Release Manager to join Netflix Game Studios to help deliver the next generation of video games to a worldwide audience. This role is a part of our Games DevOps team, and will contribute to the discipline of game release management within Netflix Gaming Studios. You will be responsible for delivering the game builds of our game platform partners and development studios onto our distribution platforms. You will work with both internal and external production teams, Partner Engineering, Quality Assurance, Launch Operations and other cross functional teams to provide clear intent to the builds we release and continuously update.ResponsibilitiesOperate the ingestion, submission and release process for the entire Netflix Games’ output.Leverage existing pipelines to ensure that our products comply with requirements for game releases and updates.Leverage information from QA reports and other inputs to document, assess and represent Release Management’s build confidence levels for each release.Contribute to the proactive identification and communication of potential release impactFacilitate smooth and timely distribution of builds across teams with the use of established tools and automation.Work with team members and cross functional partners to create, update and maintain workflows, runbooks and checklists based on new learnings and retrospectives.Play a key role in participating in our Incident Management program.Requirements3+ years of experience shipping games and updates on multiple platforms including mobile (iOS/Android), in a QA, Release Manager or Producer position.Experience with Live Service Operations and titles, having supported games in the past that operate a live service model of build and content updates.You can objectively evaluate QA reports and take into consideration context around QA service levels, launch timelines and operational goals to communicate clear, concise, and specific concerns related to the health of the builds.Ability to manage ambiguity. You use your instincts and experience to identify, assess, and solve problems quickly and frequently.Project Management and Organization Skills. Release Management is a detail-oriented job. You understand, track, and ensure that release data is 100% accurate.Passion for playing games and for understanding what makes them great.Other DutiesPlease note this job description is not designed to cover or contain a comprehensive listing of activities, duties or responsibilities that are required of the employee for this job. Duties, responsibilities, and activities may change at any time with or without notice.At Netflix, we carefully consider a wide range of compensation factors to determine your personal top of market. We rely on market indicators to determine compensation and consider your specific job, skills, and experience to get it right. These considerations can cause your compensation to vary and will also be dependent on your location.The overall market range for roles in this area of Netflix is typically $50,000-$250,000.This market range is based on total compensation (vs. only base salary), which is in line with our compensation philosophy. Netflix is a unique culture and environment. Learn more here.Location:USA - Remote",https://www.linkedin.com/jobs/view/3678240408,https://media.licdn.com/dms/image/C4E0BAQEVb0ZISWk8vQ/company-logo_100_100/0/1519896425167?e=2147483647&v=beta&t=MUfnRIPJkQ4S9chO-LfQYm84RLmN-xI-q9ZMjPG1cAs
