job_id,title,company,job_description,link_url,image
3697527193,"Manager, Contingent Talent Risk Operations",Netflix,"Netflix is the world's leading streaming entertainment service with 236 million paid memberships in over 190 countries enjoying TV series, documentaries, feature films, and mobile games across a wide variety of genres and languages. Members can watch as much as they want, anytime, anywhere, on any Internet-connected screen. Members can play, pause and resume watching, all without commercials or commitments.As Netflix grows and expands, it is becoming increasingly important to diversify the workforce in terms of worker types, geographic locations, and business lines. Netflix is committed to providing its employees with the support and resources they need to succeed and thrive in this dynamic and fast-paced environment.About The RoleThis role is part of the Talent Experience & Operations (TEO) team which designs and runs the infrastructure to deliver an outstanding talent experience from candidacy to onboarding and beyond. The Contingent Talent team under TEO is focused on building out a Risk & Compliance program. Contingent Talent is responsible for managing the company’s non-employee workforce from sourcing, onboarding, management, and offboarding.The Manager, Operational Risk & Compliance role will review and recommend internal processes, and advise internal stakeholders and business partners on risk and compliance. This entails developing risk management strategies, coordinating the creation, review, and implementation of policies and procedures, and applying compliance requirements globally.The ideal candidate will have experience balancing employment legal matters and business operations and will be capable of developing and implementing scalable solutions to ensure the highest level of compliance and risk management. Other sought-after attributes include being a self-starter and comfortable working autonomously, being a highly collaborative, strategic business partner to the business, and designing solutions that are intuitive and highly tuned with our cultureThe Manager, Operational Risk & Compliance WillDevelop and implement a comprehensive risk and compliance framework and current state assessment that addresses legal, regulatory, and operational requirements in the professional services outsourcing spaceOversee the design, implementation, and continuous improvement of processes and controls to (1) ensure adherence to laws and regulations, including but not limited to employment, data privacy, and financial regulations; and (2) ensure company readiness to operational disruptions (eg business continuity planning)Collaborate with cross-functional teams to identify, assess, and mitigate potential risks related to business operations, service delivery, and client engagementsDevelop and maintain strong working relationships with regulatory authorities, industry groups, and other relevant stakeholdersMonitor and analyze regulatory changes and industry trends to ensure the company remains proactive in its approach to risk and compliance managementProvide guidance and support to senior leadership on risk and compliance matters, ensuring alignment with company strategy and objectivesDevelop and deliver training programs to educate employees on relevant laws, regulations, and best practicesServe as the primary point of contact for internal and external audits, managing and coordinating responses and corrective actions as necessaryWe Want Someone Who IsBachelor's degree in law, business administration, or a related field; advanced degree (JD, MBA, or equivalent) preferredA minimum of 10 years of experience in risk and compliance, with at least 5 years in the professional services outsourcing industry. Equivalent experience in consulting applied to these domains would preferred, but not requiredStrong knowledge of employment law, regulatory requirements, and industry best practices related to professional services outsourcing at a global scaleProven track record of developing and implementing risk and compliance programs at scale and globally (e.g. with knowledge of regional/country nuances in major BPO destinations)Excellent communication and interpersonal skills including building narratives that “stick” and simplifying the complexDeep experience in collaborating effectively with cross-functional teams and senior leadershipStrong analytical and problem-solving skills, with the ability to identify and assess risks, develop effective mitigation strategiesHigh degree of professionalism, integrity, and ethical decision-makingA motivated self-starter, able to thrive in a fast-paced environment with quickly changing business needs, multiple priorities and deadlinesAt Netflix, we carefully consider a wide range of compensation factors to determine your personal top of market. We rely on market indicators to determine compensation and consider your specific job, skills, and experience to get it right. These considerations can cause your compensation to vary and will also be dependent on your location.The overall market range for roles in this area of Netflix is typically $195,000 - $510,000.This market range is based on total compensation (vs. only base salary), which is in line with our compensation philosophy. Netflix is a unique culture and environment. Learn more here.",https://www.linkedin.com/jobs/view/3697527193,https://media.licdn.com/dms/image/C4E0BAQEVb0ZISWk8vQ/company-logo_100_100/0/1519896425167?e=2147483647&v=beta&t=MUfnRIPJkQ4S9chO-LfQYm84RLmN-xI-q9ZMjPG1cAs
3592348616,"Program Manager, Renewable Energy & Carbon Credit Procurement",Netflix,"We are open to this role being remote anywhere across the globe, not just in the US!**Netflix is the world's leading streaming entertainment service with over 230 million paid memberships in over 190 countries enjoying TV series, documentaries, feature films and mobile games across a wide variety of genres and languages. Members can watch as much as they want, anytime, anywhere, on any Internet-connected screen. Members can play, pause and resume watching, all without commercials or commitments. Visit our culture memo and long-term view to learn more about Netflix and how we work.Netflix Sustainability serves to tackle our carbon footprint at the speed prescribed by climate science, raising awareness through our film and television content, and engaging our millions of members on climate & environmental change. See more at sustainability.netflix.com.The OpportunityLeveraging Netflix’s innovative and fast paced culture, help Netflix attain its public climate targets to cut our emissions in half by 2030 and (as of 2022), to annually bring our remaining net carbon footprint to zero by investing in the power of nature to capture carbon.ResponsibilitiesReporting to Director of Sustainability & Operations, this role will work closely with senior team members to manage the company’s investments in carbon credits and renewable energy, including but not limited to:Maintaining a balanced, diverse portfolio of high-quality carbon credits essential to our second public climate targetStructuring buy-forward deals that help project developers bring new high-quality credits to market in areas called for by climate science (e.g. blue carbon)Vetting the quality of carbon credits against our 5 screening criteria (p19 of our ESG report)Negotiating for reasonable pricing directly with project developersMatching the volume of tons retired in a given year to the annual carbon footprintContributing to scientific- and NGO-led efforts to scale high-quality credit sources and procurement practices thereof (e.g. BASCS)Supporting renewable energy purchases, ranging from annual EAC purchases to project specific investment opportunities: Structuring and leading competitive procurements (RFIs/RFPs)Liaison with vendor and project developersConduct emissions analysis and synthesize procurement recommendations for decision-maker considerationPartner with finance teams to conduct project-level financial analysis Data tracking and systems maintaining for required annual footprint and emissions reductions accountingQualifications5 years of experience with carbon credit procurement2+ years with renewable energy procurement (familiarity with voluntary RE markets a plus)2+ years of experience with sourcing, structuring, and executing deals in carbon credits and/or renewable energy Experience collaborating with the carbon credit and renewable energy communities (coalitions, research groups, policymakers, vendors, 3rd party certifiers, etc)Proven experience with the best 3rd party standards responsible for ensuring additionality, permanence, non-leakage, realistic baselines, and no double countingExperience in portfolio management of:Carbon credits in both reductions and removals with emphasis on nature-based solutions of high integrity and optimal ‘co-benefits’ (i.e. community livelihoods, water, biodiversity)Renewable energy investments, including direct sourcing, utility-based supply programs to bundled and unbundled creditsAt Netflix, we carefully consider a wide range of compensation factors to determine your personal top of market. We rely on market indicators to determine compensation and consider your specific job, skills, and experience to get it right. These considerations can cause your compensation to vary and will also be dependent on your location.The overall market range for roles in this area of Netflix is typically $60,000 - $290,000This market range is based on total compensation (vs. only base salary), which is in line with our compensation philosophy.Netflix is a unique culture and environment. Learn more here.",https://www.linkedin.com/jobs/view/3592348616,https://media.licdn.com/dms/image/C4E0BAQEVb0ZISWk8vQ/company-logo_100_100/0/1519896425167?e=2147483647&v=beta&t=MUfnRIPJkQ4S9chO-LfQYm84RLmN-xI-q9ZMjPG1cAs
3592353220,"Systems Designer, Games Studio",Netflix,"Netflix is building a new internal game studio to incubate and build a new class of hilarious, social party video games.The Systems Designer will work closely with a new cross-discipline core team to rapidly prototype and iterate towards a new game vision, building confidence on a great game prototype to eventually bring to full production and make available to Netflix members.In addition to finding the fun, a successful candidate will also be able to design meta-systems that maximize player retention and virality. We strive to make amazing games that are not only fun to play but also drive players to keep coming back and share the experience with their friends and family. So if you’re a creative designer with a knack for making games sticky, this may be the perfect role for you.You’ll be joining a small, scrappy team with big ambitions, and an obsession to create memorable game moments that leave players telling their own stories for years to come. We’re looking for new teammates who care deeply about the experiences they create and the people they make them with. Those who bias towards action and are energized by the learning that comes with bold experimentation at an agile pace. As a part of Netflix, we strive to hire the best and value integrity, excellence, respect, inclusion, and collaboration.Now is an amazing time to join Netflix Game Studio as we seek to entertain our 200 million paid members in a really new way.ResponsibilitiesGame Progression: Design and map out game progression from a systems perspective that is built to enhance player retentionBalance: Work on the overall pacing and balance of our gamesCommunity: Design features that allow players to connect with each other and foster a community of sharing and viralityFind-the-fun: Design, prototype, and test exciting new experiences in the social party space. This includes both paper tests and digital prototypesDocumentation: Provide clear feature documentation, complete with diagrams and analyses, backed up with numbers, wireframes and prototypes, as neededCollaboration: Work with teammates by providing and receiving creative/team feedback, plus’ing others’ creative contributions, and providing clear creative goals with intentionally desired outcomesRequirements3+ years experience as a game designer shipping multiple large-scale productsPrior Unity development experienceExperience designing live ops meta-game features that drive player retention and viralityExperience designing and mapping out game progression systemsExceptional communication and cross-discipline collaboration skillsPassion for making video games, especially in a rapid, focused, smaller form vs multi-year investmentsBonus SkillsFamiliar with visual design tools such as Playmaker or BlueprintFamiliarity with video and board games that are in the social party space Able to use art tools needed to share ideas such as Adobe CCFamiliarity with flowcharting tools such as Miro and FigmaWriting skills and comedy chops are always a plusLocationLos Angeles Preferred/RemoteAt Netflix, we carefully consider a wide range of compensation factors to determine your personaltop of market. We rely on market indicators to determine compensation and consider your specific job, skills, and experience to get it right. These considerations can cause your compensation to vary and will also be dependent on your location.The overall market range for roles in this area of Netflix is typically $50,000 - $250,000.This market range is based on total compensation (vs. only base salary), which is in line with our compensation philosophy. Netflix is a unique culture and environment. Learn more here.",https://www.linkedin.com/jobs/view/3592353220,https://media.licdn.com/dms/image/C4E0BAQEVb0ZISWk8vQ/company-logo_100_100/0/1519896425167?e=2147483647&v=beta&t=MUfnRIPJkQ4S9chO-LfQYm84RLmN-xI-q9ZMjPG1cAs
3697804854,"Sales Partner Lead, UK",Netflix,"Netflix is the world's leading streaming entertainment service with over 230 million paid memberships in over 190 countries. Our mission is to entertain the world and we are constantly innovating to bring the best stories from around the world to our members. With the incredible launch of our ad-supported model, we are now working toward providing more choices for consumers and a premium brand experience for advertisers. We are now seeking a Sales Partner Lead to help shape the UK sales strategy for Netflix.As the Sales Partner Lead, you will be responsible for helping lead the development and execution of sales strategy for the UK. You will work closely with the senior level Investment and Account Planning stakeholders at the Agency operating companies within an Agency Holding group.The role will involve a combination of developing business with the senior stakeholders at a given major agency group alongside the building of key client relationships with C-level, VP, and Director contacts within those portfolios. As the Sales Partner Lead, you will be tasked with jointly driving Netflix Advertising opportunities with both key Agency partners and Client leaders.You will be accountable for delivering revenue targets by leveraging Netflix's unique audience insights and premium content offerings. You will work closely with our Measurement Leads to develop the best-in-class measurement solutions to meet our Clients’ needs. The role will also be a focal point for driving the necessary internal developments to ensure our success. Cross-functional collaboration with Ad Product, Marketing, Content, and Partnership Development teams will be crucial.The ideal candidate will have a deep understanding of the advertising ecosystem in the UK, an established network of relationships, and a track record of delivering revenue growth.Key ResponsibilitiesDevelop and execute Agency focused sales for the UK to deliver revenue targets and exceed client expectations.Build and maintain strong relationships with a major Agency Holding group and related Agencies to secure ad partnerships and drive revenue growth.Develop long term relationships with key senior Clients within those portfolios.Partner with Microsoft Partner teams to respond to briefs and grow the business togetherDevelop sales strategies and sales plans for the assigned Account portfolio Collaborate with cross-functional teams to ensure the successful delivery of advertising campaigns.Leverage Netflix's unique audience insights and premium content offerings to drive revenue growth.Monitor market trends, competitor activity and identify opportunities for innovation.We’re Looking ForAt least 10 years of experience in advertising (incl. sales) with a proven track record of delivering revenue growth.Deep understanding of the Media Agencies/Holding Companies in the UK and an established network of relationships at senior level within them.Experience in both TV and digital advertising sales will be a plusA degree of people management experience is preferableStrong analytical (strategic and creative) capabilities and judgment.Excellent communication and presentation skills.Ability to work effectively and collaboratively cross‐functionally.Open to the challenge of starting a new business, comfortable with risk, uncertainty and ambiguity",https://www.linkedin.com/jobs/view/3697804854,https://media.licdn.com/dms/image/C4E0BAQEVb0ZISWk8vQ/company-logo_100_100/0/1519896425167?e=2147483647&v=beta&t=MUfnRIPJkQ4S9chO-LfQYm84RLmN-xI-q9ZMjPG1cAs
3636939091,Software Engineer (L5/L6) - Open Connect Platform,Netflix,"At Netflix, we want to entertain the world and are constantly innovating on how entertainment is imagined, created and delivered to a global audience. We currently stream content in more than 30 languages in 190 countries, topping over 220 million paid subscribers and are expanding into new forms of entertainment such as gaming.Bring your passion for games and joy of enabling others as we build our games experience. We are rapidly expanding new gaming offerings, so we are seeking an engineer with a wide breadth of experience who is excited to help us lead the continued building and scaling of our efforts for our international audience.This role involves architecting, authoring, and maintaining highly-complex software stacks for our cloud gaming service. This requires an engineer comfortable working throughout the application pipeline, including hardware accelerated video/audio/data processing, media encoding/decoding, and network transport algorithms. This requires engineers whose expertise covers optimizing both local system performance (writing high-performance, efficient code with a deep understanding of both hardware and software dynamics) and total system performance (including efficient and effective use of Internet connectivity). All engineers must be comfortable with producing high-quality solutions to business problems in the midst of high ambiguity to continue to push the boundary on what they can accomplish. We provide the freedom to execute, learn and pivot, and the responsibility to be self directed, collaborative and insightful. This gives you the freedom to do your best work and contribute directly to the success of the business.You Will Be Successful In This Role If YouAre a quick learner and excited about learning new technologiesAdvocate software craftsmanship and take pride in your workThrive in an environment with lots of context and minimal guidanceEnjoy collaborating with engineers across functional teams and have excellent communication skillsEnjoy taking full ownership of projects from conception to productionQualificationsExperience developing and optimizing high performance, real-time applications such as games or simulationsStrong C or C++ coding skillsNice To HaveExperience writing SDKsExperience with rendering APIs (e.g. Vulkan, DirectX, Metal, OpenGL)Coding skills in multiple languages (e.g. Go, Python, Rust)Experience with game developmentExperience analyzing and accelerating graphics workloadsExperience working with the Unity or Unreal game enginesExperience with automating functional and performance testing",https://www.linkedin.com/jobs/view/3636939091,https://media.licdn.com/dms/image/C4E0BAQEVb0ZISWk8vQ/company-logo_100_100/0/1519896425167?e=2147483647&v=beta&t=MUfnRIPJkQ4S9chO-LfQYm84RLmN-xI-q9ZMjPG1cAs
3631809668,"Product Manager, Partner Integration Enablement",Netflix,"At Netflix, scaling to connect 230+ million people in 190 countries with TV series, movies, and games requires not only great content, but also strategic partnerships and product integrations that make it easy to discover and enjoy Netflix. On our Partner Product team, we work with many stakeholders to tackle opportunities and problems encountered in entertaining the world. We’re looking for skilled product leaders who can both effectively evolve Netflix experiences and help technically shape the future of entertainment through partners, globally.As a product manager for Partner Integration Enablement, you will work closely with cross-functional stakeholders to influence how we integrate various Partner products (such as Partner Payment capabilities or experiences in our Partners UIs) with platform partners (such as Google, Amazon, and Roku), as well other global and regional consumer electronics (Sony, Samsung, TCL) and operator (Comcast, Telefonica, Sky, Orange) partners.Applying both qualitative feedback and quantitative metrics to guide decisions and measure success, you will be responsible for driving requirements for effective end-to-end product integration workflows, and delivering them alongside our engineering/other relevant teams to internal stakeholders and partners. You’ll drive a product roadmap that aids in API development, partner configurations of products, platform evolutions, stakeholder tools, and integration testing amongst many types of enhancements. Success in this role will rely heavily on strategic thinking, technical prowess, and the ability to influence a broad set of stakeholders. Developing efficiently paved roads for partner implementation, creating authoritative data systems, and effectively scaling your colleague’s operational output are key objectives. We are looking for someone who has scaled API or partner/client-oriented products in a highly cross-functional environment.This is a dynamic role with a tremendous impact on how current and future members around the world will discover, watch, and pay for Netflix content. Be sure to review our culture page (here) and long-term view to learn more about the unique Netflix culture and the opportunity to be part of our team.What You Will DoServe as an end-to-end owner of standardizing partner integration onboarding, configuration, testing, launch, documentation, learning/training, and post-launch data managementMake decisions that are partner empathetic - consider adjacent but relevant product concerns such as security, privacy, and/or fraud - and manage organizational costsCollaborate in the development of requirements for partner-facing APIs - enabling new partner and member experiences for delivery and scaling of products that enhance Netflix membershipDefine partner metadata strategies aligned with Netflix strategic principles to ensure continuity across data structures - enabling both internal and partner-relevant workflows relevant to partner devices, payments, user interfaces and moreDrive requirements for the creation of partner and internal tooling and systems for execution (e.g., test tools, dashboards, developer portal capabilities)Measure effectiveness, and provide data-driven technical product and partner policy choicesLead a team of stunning colleagues across design, engineering, consumer insights, and data science to deliver outstanding products to our customers.Qualifications5+ years of experience as a Product ManagerSuccessful work with Partnerships, API Integration, Distributed Systems and/or similar fieldsProduct management experience with a proven record of prioritizing and successfully launching impactful products or platforms.Proven track record of managing and evolving a product portfolio and/or driving product vision and strategyStrategic thinker with a healthy blend of deep technical knowledge with a customer-focused mindset and empathyAbility to inspire, motivate and lead a cross-functional team - your ability to build strong relationships and influence several role types and functions is critical to success.Comfortable applying a combination of qualitative and quantitative methods to define successInsatiable curiosity to learn new domains, keep up with industry innovation, and constantly ask ‘why’Excellent written and verbal communication skills; timely communication with clear expectations At Netflix, we carefully consider a wide range of compensation factors to determine your personal top of market. We rely on market indicators to determine compensation and consider your specific job, skills, and experience to get it right. These considerations can cause your compensation to vary and will also be dependent on your location.The overall market range for roles in this area of Netflix is typically $80,000 - $550,000.This market range is based on total compensation (vs. only base salary), which is in line with our compensation philosophy. Netflix is a unique culture and environment. Learn more here.",https://www.linkedin.com/jobs/view/3631809668,https://media.licdn.com/dms/image/C4E0BAQEVb0ZISWk8vQ/company-logo_100_100/0/1519896425167?e=2147483647&v=beta&t=MUfnRIPJkQ4S9chO-LfQYm84RLmN-xI-q9ZMjPG1cAs
