job_id,title,company,job_description,link_url,image
3675917338,"Product Designer, Partnerships",Netflix,"About Our TeamNetflix is one of the largest global subscription services and we’re expanding to new markets around the world. The Partnerships team’s mission is to grow our member base and make Netflix accessible by innovating user experiences and building strong relationships with our business partners.We’re a team of product designers with a broad set of UX skills ranging from interaction design, content strategy, research, prototyping, and strategy. We work in close collaboration with product, business, and engineering partners to build new experiences for people around the globe. We pride ourselves on a strong culture of creativity, accountability, and experimentation, and you’ll work on rich and complex problems like how we bundle Netflix with our partners, how to bring an innovative approach to technical partner challenges, and much more.The RoleWe are looking for a curious, driven and collaborative Product Designer to help explore and push the boundaries of the Netflix partnerships product space. This role will work closely with a stunning team of designers, product managers, engineers and partnerships teams to create user experiences that drive Netflix customer acquisition, engagement, and retention via partner channels where people purchase and engage with Netflix. We work on a variety of projects like sign up experiences across complex TV operator environments and exploring new partner business opportunities in markets with prepaid payments. This role will push the current product boundaries, and work closely with product and business teams to drive innovation momentum into the future.This will be a remote-friendly role, with expectations of travel several times a year to a global Netflix offer for team onsites and meaningful moments of collaboration and bonding. We want you to be happy and have a work-life-balance that enables you to thrive!Why You’ll Love It HereWe're big on individual responsibility and lean on process, so there's room for you to drive product design decisionsYou’ll work with stunning, supportive designers on problems that matter.Leadership that guides with joy, mentorship, passion and optimism.Top-of-market compensation and benefits, flexible time off, and work-life balance.Remote flexibility to balance work-from-home and in-office work, so long as you’re able to be onsite for meaningful collaboration.Freedom and flexibility to craft your own design workflow, while harnessing Netflix’s world-class design systems.An inclusive and supportive environment to inspire your best work.How You’ll Have ImpactCollaborate with other designers, product managers, engineers and payment partners to design and build payment experiences.Advocate for the user and craft UX solutions that meet critical business objectives and inspire the team to push the status quo.Create simple, intuitive experiences in a space that has complex rules and workflows.Work on a range of projects on different platforms (TV, mobile, web, and more).Design with scalability in mind and actively contribute to our design system and UX guidelines.Work closely with our partnerships and research teams to understand expectations, needs, and attitudes of our members around the world.Influence future innovation spaces to drive product and business growth.What We’re Looking ForA passionate energy for great design, collaboration and amplifying our team culture.5+ years as a Product Designer (or equivalent experience) and a versatile portfolio that showcases deep interaction and problem solving skills.Ability to use systems thinking in technical spaces to break down complexity into solvable problems.Able to go deep and think about the ins-and-outs and edge cases, and to go wide to connect the dots between Netflix and our partners.Experience in business innovation contexts and leading design strategy and execution from 0 to 1 with minimal oversight and well-organized operational rigor.The communication skills to articulate your concepts and drive alignment with your cross-functional stakeholders.Experience using and contributing to design systems.Ability to flex between different types of projects simultaneously.An appreciation and understanding of A/B testing and comfort using data to inform design decisions.An earnest, mature, and ego-free attitude that welcomes candid feedback.A willingness to fail and learn.Even BetterDesign experience working on growth strategies and with global partnersA global or multi-regional perspective.A passion for entertainment, filmmaking, and storytelling.At Netflix, we carefully consider a wide range of compensation factors to determine your personal top of market. We rely on market indicators to determine compensation and consider your specific job, skills, and experience to get it right. These considerations can cause your compensation to vary and will also be dependent on your location. The overall market range for roles in this area of Netflix is typically $80,000-$550,000. This market range is based on total compensation (vs. only base salary), which is in line with our compensation philosophy. Netflix is a unique culture and environment. Learn more here.",https://www.linkedin.com/jobs/view/3675917338,https://media.licdn.com/dms/image/C4E0BAQEVb0ZISWk8vQ/company-logo_100_100/0/1519896425167?e=2147483647&v=beta&t=MUfnRIPJkQ4S9chO-LfQYm84RLmN-xI-q9ZMjPG1cAs
3635246999,PR Manager - Nordics,Netflix,"Netflix is the world's leading streaming entertainment service with 233 million paid memberships in over 190 countries enjoying TV series, documentaries, feature films and mobile games across a wide variety of genres and languages. Members can watch as much as they want, anytime, anywhere, on any internet-connected screen. Members can play, pause and resume watching, all without commercials or commitments.The OpportunityThis is a great opportunity to join a team that is spearheading and handling PR campaigns for the world's leading entertainment-on-demand service, with a chance to work on projects from the brightest creatives and talents around the world. The PR Manager will work as part of the Nordics PR team and will report to the PR Director, Nordics.The RoleThe PR Manager will work across films, series, documentaries and unscripted titles. They will formulate and execute PR campaigns for the growing content slate that span across all genres from action blockbusters to fantasy, from rom-coms to sci-fi, and from dramas to mystery-thrillers.We are looking for someone who has experience in delivering strong PR campaigns, who will have a creative and strategic approach and will work well within a wider cross-functional team. The successful candidate has a great knowledge of the Nordic media landscape and the region. We are looking for someone who is a self-starter and loves the thrill of seeing impactful campaigns come to life! The person will be able to communicate priorities and present clear goals to stakeholders and form and maintain strong relationships with media, key opinion leaders, influencers as well as talent representatives and talents.The ideal candidate will have a strong work ethic and will not be afraid to challenge prevailing assumptions, and suggest better approaches; they will make decisions without agonizing and will be candid and direct. They are scrappy, unafraid to jump in and handle tasks at all levels and they thrive in a high energy, fast-paced environment. The day to day responsibilities will include, but are not limited to, formulating and implementing PR strategies in the Nordics, writing press releases, managing press nominations, scheduling junkets, liaising with journalists, influencers, talent representatives and talent, implementing screening strategy and managing agencies on campaigns.As The Successful Candidate, You WillHave at least +8 years of experience in Nordic PR setting – either agency or companyPossess a keen understanding of new and traditional media in the Nordics.Have excellent verbal and written skills in both English and one of the Nordic languages and be able to communicate effectively and succinctly with internal and external teams.Experience in crisis communication and shaping PR campaigns.Be skilled managing agencies and cultivating relationships with journalists, influencers as well as talent representatives and talent.A love of entertainment and storytelling and the ability to build narratives and put together strategic communication plans across multiple functions.Be able to manage multiple tasks simultaneously under deadline and thrive in a high energy, fast-paced environment.Be able and willing to think on an international level.Be curious and eager to learn, have sound judgment, and be unafraid to challenge prevailing assumptions.Be able to understand and comfortably interpret business and technology issues.Be nimble and objective in assessing your work, be willing to admit mistakes quickly, and to give and receive constructive feedback.For more about Netflix please read our long term view and culture memo. A commitment to embrace and advocate for inclusion is essential.",https://www.linkedin.com/jobs/view/3635246999,https://media.licdn.com/dms/image/C4E0BAQEVb0ZISWk8vQ/company-logo_100_100/0/1519896425167?e=2147483647&v=beta&t=MUfnRIPJkQ4S9chO-LfQYm84RLmN-xI-q9ZMjPG1cAs
3677972515,Software Engineer (L5) - Game Platform Developer Tools,Netflix,"You may have seen the news that Netflix is getting into gaming; this is your chance to be a key part of it! We are a growing team building a cloud platform that aims to bring Netflix games to our subscribers on a variety of devices beyond mobile phones.We are looking for an engineer specializing in identifying and building developer workflows and tooling who will serve as a key contributor to creating the suite of tools that make fast iteration and development of games for our platform a delight.ResponsibilitiesHelp define, scope, and plan development of game developer toolsBuild new tools and integrate existing development tools to work with our platformThis Role Is a Fit If YouTake pride in building high-quality tools for developersLove working on early stage projects where your contributions make a big differenceThrive in an environment with lots of context and minimal guidanceEnjoy collaborating with engineers across functional teamsAre a self-starter with excellent communication skillsQualifications8+ years of full stack development experienceExperience with Node.js, JavaScript/TypeScript and ReactNice To HaveExperience working with game engines such as Unity and UnrealExperience with the Electron frameworkExperience with CockroachDB/SQLDoes this sound interesting? Or does this sound interesting but intimidating? Please don’t self-select out, let’s figure it out together. We’d love to talk to you!Netflix is a global company with a diverse member base, which is why the content we produce reflects that: global perspectives and global stories. As we grow globally, we must have the most talented employees with diverse backgrounds, cultures, perspectives, and experiences to support our innovation and creativity. We are an equal-opportunity employer and strive to build balanced teams from all walks of life.Our culture is unique, and we tend to live by our values, so it’s worth learning more about Netflix here.At Netflix, we carefully consider a wide range of compensation factors to determine your personal top of market. We rely on market indicators to determine compensation and consider your specific job, skills, and experience to get it right. These considerations can cause your compensation to vary and will also be dependent on your location. The overall market range for roles in this area of Netflix is typically $300,000 - $900,000. This market range is based on total compensation (vs. only base salary), which is in line with our compensation philosophy.",https://www.linkedin.com/jobs/view/3677972515,https://media.licdn.com/dms/image/C4E0BAQEVb0ZISWk8vQ/company-logo_100_100/0/1519896425167?e=2147483647&v=beta&t=MUfnRIPJkQ4S9chO-LfQYm84RLmN-xI-q9ZMjPG1cAs
3631812118,"Engineering Manager, Consumer Connect and Authenticate",Netflix,"Netflix is the world’s leading streaming entertainment service with over 230 million paid memberships enjoying TV series, documentaries, feature films and now games, across a wide variety of devices, genres and languages. As a global household brand, we strive to bring joy to users by connecting them with stories and artists through a delightful and high-quality experience.The Consumer Connect and Authenticate team at Netflix enables secure access to Netflix (streaming and games) with member login and authentication at scale, serving device context and capabilities for our content discovery and product experiences, and the protocols for device and app connections. We are looking for an Engineering Manager to deliver high-impact results and drive the development and innovation of our authentication experiences, device connect and capability systems and backend services. To do this, you will need to partner with engineering teams across Netflix as well as work closely with X-functional partners.This role is remote-inclusive and our teams work in a hybrid-working model.About YouYou are an inclusive leader with a proven track record of building and leading high-performing diverse teams.You are a delightful partner for your engineering, product, and business colleagues.You have a proven track record of taking innovative projects from concept to production, preferably in the authentication domainYou are inherently curious and enjoy building high scale, low latency applications.You are a proactive, effective communicator and have a bias towards decisive action.Scope of the roleYou will be a leader of the Consumer Connect and Authenticate engineering team, employing inclusive practices to manage a hybrid-located team with a range of tenures and experiences.You will innovate in the consumer authentication and devices domain with an architectural and long-term leverage vision, both of Netflix's needs and looking ahead to the industry trends.You will build roadmaps, in partnership with the team and stakeholders, with the right prioritization and execution for product and engineering initiatives that delight our consumers.You will be a trusted advisor and collaborator in effectively prioritizing cross-functional partnerships and projects with Product Management, Data Science, Security and Engineering teams.Must-HaveTechnical Depth and Vision - Demonstrated success in building/leading complex architectures and distributed systems, with preference in the authentication / login / registration domain. Vision to define what needs to be planned technologically to be able to meet future needs of Netflix, including scale, operational stability and loosely coupled architecture for customer facing servicesEngineering mindset - Constantly reviews the engineering practices in the team / org for improvements and efficiency. Technically curious and stays engaged in the technical innovation and encourages learning in the team.Mature Leadership -Thoughtful, candid and strong interpersonal skills. Can lead and mentor senior engineers. Inclusive. Leads with Context and not control. Ability to identify and hire and grow dense talent. Can provide candid feedback and deal with less than expected performance quicklyInternal partnership - A strong partner for product management and engineering leaders. Equally passionate about working with engineering and non-engineering stakeholders.Selflessness - Will lead with “Netflix First” attitude. Do the right thing for Netflix.Nice to HaveExperience leading remote teamsOur team includes people of all genders, varied sexual orientations, parents, folks who are self-taught, and people of a wide variety of nationalities, ages, and socio-economic backgrounds. Diverse teams are strong teams, and we encourage those with varied identities and experiences to apply.At Netflix, we carefully consider a wide range of compensation factors to determine your personal top of market. We rely on market indicators to determine compensation and consider your specific job, skills, and experience to get it right. These considerations can cause your compensation to vary and will also be dependent on your location.The overall market range for roles in this area of Netflix is typically $373,000 - $699,000.This market range is based on total compensation (vs. only base salary), which is in line with our compensation philosophy. Netflix is a unique culture and environment. Learn more here.",https://www.linkedin.com/jobs/view/3631812118,https://media.licdn.com/dms/image/C4E0BAQEVb0ZISWk8vQ/company-logo_100_100/0/1519896425167?e=2147483647&v=beta&t=MUfnRIPJkQ4S9chO-LfQYm84RLmN-xI-q9ZMjPG1cAs
3676108798,"Senior Generalist Engineer, Games Studio",Netflix,"Netflix is building a new internal game studio to incubate and build a new class of hilarious, social party video games.The Senior Generalist Engineer will work with a new cross-discipline core team to rapidly prototype and iterate towards a new game vision, building confidence on a great game prototype to eventually bring to full production and be available to Netflix members. A successful candidate will be able to establish workflows for other developers, integrate multiple platform technologies from external teams into our game project, build lower-level systems and content creation tools to support higher-level feature systems and help deploy and maintain our builds for both client and server.You’ll be joining a small, scrappy team with big ambitions, and an obsession to create memorable game moments that leave players telling their own stories for years to come. We’re looking for new teammates who care deeply about the experiences they create and the people they make them with. Those who bias towards action and are energized by the learning that comes with bold experimentation at an agile pace. As a part of Netflix, we strive to hire the best and value integrity, excellence, respect, inclusion, and collaboration. Now is an amazing time to join Netflix Game Studio as we seek to entertain our 200 million paid members in a really new way.ResponsibilitiesInfrastructure Pipelines: Support CI/CD for code and data changes for both client and server. Set build pipelines with external teams supporting Automation and Cloud.Platform Tech Integration: Research Netflix's own platform technologies and write code for integrating those into our game project. Come up with best practices for using them and guide other engineers with any edge cases or limitations. Be a representative when communicating with the Platform team.Dev Tools: Develop and maintain GUI, CLI, and web tools that will enable content creation for internal and external developers, and enable automated deployment of that content across client and serverRequirements5+ years experience as an engineer shipping multiple gamesExtensive knowledge with C# and .NET tech, make build vs buy decisionsFamiliarity with Unity or other game enginesFamiliarity with AWS or other cloud technologiesExceptional communication and cross-discipline collaboration skillsPassion for making video games, especially in a rapid, focused, smaller form vs multi-year investmentsBonus SkillsExperience building tools for content creatorsFamiliarity with CI/CD systems like JenkinsFamiliarity with ASP.NETLocationLos Angeles Preferred/RemoteAt Netflix, we carefully consider a wide range of compensation factors to determine your personaltop of market. We rely on market indicators to determine compensation and consider your specific job, skills, and experience to get it right. These considerations can cause your compensation to vary and will also be dependent on your location.The overall market range for roles in this area of Netflix is typically $100,000 - $350,000.This market range is based on total compensation (vs. only base salary), which is in line with our compensation philosophy. Netflix is a unique culture and environment. Learn more here.",https://www.linkedin.com/jobs/view/3676108798,https://media.licdn.com/dms/image/C4E0BAQEVb0ZISWk8vQ/company-logo_100_100/0/1519896425167?e=2147483647&v=beta&t=MUfnRIPJkQ4S9chO-LfQYm84RLmN-xI-q9ZMjPG1cAs
3697442764,"Engineering Manager, Consolidated Logging",Netflix,"As Netflix continues to grow, we are venturing into exciting new frontiers that help our members find the content they’ll most enjoy. At the core of all this innovation is reliable, high-quality data which fuels progress in the form of new user experiences and personalization.Netflix is looking for a seasoned engineering leader to head the Consolidated Logging team. This team is responsible for the consumer-facing logging infrastructure which enables analysis, experimentation, and personalization across the entire Netflix experience. In this role, you will be responsible for building and leading a team of extraordinary engineers who will partner across the company to build cutting edge improvements to the Netflix product. You will help influence and guide projects from end-to-end: ideation to production.To be successful in this role, you need to be a strong people manager; great at giving and receiving feedback, fostering new ideas, and empowering others. You also need a strong software engineering background, to be a quick and data-driven learner, to have proven data engineering and system design skills, and the ability to lead large multi-disciplinary, cross-functional teams.ResponsibilitiesRecruiting: You are constantly on the lookout for talent and have a knack for recognizing and attracting top-tier engineers to your team. You understand the importance of building an amazing team that is additive and diverse, and the value it brings to the overall company.Feedback & Development: You will coach and guide employees through their strengths and weaknesses through regular feedback.Contribute to Data Science & Engineering Leadership. You will be expected to participate in leadership conversations and interview for engineering teams across Netflix.Vision: You intuitively understand business and technology and you leverage that to guide a team by providing relevant context and inspiration.Partnership: You will continue to establish strong relationships with both business and technical leaders across Netflix.Skills & CharacteristicsYou are a natural people leader who also demonstrates humility. You care deeply about people, and their success. You invest in your relationships, so that you have an understanding of the whole person and their perspective.You’re not afraid of hard conversations, and are gifted at coaching your colleagues through difficult situations. You are comfortable sharing your perspective on challenging people dynamics.You seek to de-escalate tense situations, and are creative & flexible in finding balance with partners to maximize impact.You are a strong communicator, and self-aware about how others perceive your comments. As someone in a leadership role you aim to be assertive, not passive nor aggressive, in providing input, support, and feedback.You are forward-looking and able to anticipate the investments Netflix should be making to improve efficiency, innovation, and alignment. You identify areas for continuous improvement, and persistently advocate for action to address them.You have an impeccable eye for technical talent, and a history of influencing hiring decisions across organizations. In this role you will be expected to understand how the Data Science & Engineering organization’s broad hiring strategy translates into the needs of our team, and our partners.You’re allergic to micromanagement. You prefer to give context, delegate, and watch amazing people exceed your hopes and expectations.You work hard, and you have healthy boundaries. You know how to prioritize both your work and personal commitments without set boundaries or guidelines.Preferred RequirementsYou have 10+ years software development experience. You have a mastery of object-oriented design and design patterns, and programming skills.You have 5+ years of engineering team management experience.You have a MS in Computer Science/Engineering, or related field.You have used big data technologies (i.e. Spark/MapReduce/Hadoop, etc.) at one point in your career, and have built web-scale data pipelines.You have used SQL and reporting tools at one point in your career, and are analytically savvy.The overall market range for roles in this area of Netflix is typically $310,000 - $1,200,000.This market range is based on total compensation (vs. only base salary), which is in line with our compensation philosophy. Netflix is a unique culture and environment. Learn more here.Two More Things To KnowOur culture is unique and we live by our values, so it's worth learning more about it at https://jobs.netflix.com/culture.We are an equal opportunity employer and value diversity at our company. We do not discriminate on the basis of race, religion, color, national origin, gender, sexual orientation, age, marital status, veteran status, or disability status.",https://www.linkedin.com/jobs/view/3697442764,https://media.licdn.com/dms/image/C4E0BAQEVb0ZISWk8vQ/company-logo_100_100/0/1519896425167?e=2147483647&v=beta&t=MUfnRIPJkQ4S9chO-LfQYm84RLmN-xI-q9ZMjPG1cAs
